{
  "schema_version": "1.5.0",
  "project_id": "researchforge",
  "product_scope_version": "1.7",
  "contract_package_version": "1.5.0",
  "completed_gates": [
    "V15_DIRECTION",
    "V15_REAL_DATA",
    "V15_RESEARCH_UX",
    "V15_PILOT_READY",
    "V15_DEMO",
    "V15_PRODUCT",
    "FACT_EXTRACTION",
    "GENERALIZATION",
    "N8N_INTEGRATION",
    "PRODUCT_HARDENING"
  ],
  "current_gate": "RELEASE_FREEZE",
  "gate_status": "in_progress",
  "current_milestone": {
    "id": "v185_remote_closeout",
    "title": "V1.8.5 local engineering complete; GitHub remote closeout pending",
    "outcome": "V1.8.5 security, Agent Eval, Failure Analysis, Retrieval Benchmark, MCP and interview/architecture hardening pass the fresh local gate without changing the V1.7 research truth boundary. Remote CI and owner re-acceptance remain.",
    "status": "in_progress"
  },
  "frozen_v1_4": {
    "outcome": "RESEARCH_HYPOTHESIS_UNSUPPORTED_AFTER_TWO_EXPERIMENTS",
    "primary_result_hash": "60d7620ca0f620e926c99f22a091d7305097dd787c28d89270977cb8a6c735ed",
    "contingency_result_hash": "dadd29917979b53a2b47ed66e7bfa9deae6ba8486802acc12bdba38ab3a3877f",
    "combined_outcome_hash": "bdc0c1aed55e930312f01ecaebee8969e96e7ff625b27b735b940fcff8a1d2af",
    "additional_formal_experiments_authorized": false
  },
  "last_verified": {
    "at": "2026-09-06T03:10:00+08:00",
    "commands": [
      {
        "command": "uv lock --check; ruff format/check; mypy --strict; pytest -q; validate_contracts.py",
        "exit_code": 0,
        "summary": "V1.8.5 backend gate passed: 233 pytest tests, strict mypy over 120 source files, 625 schema refs plus validated V1.8 engineering evidence."
      },
      {
        "command": "researchforge eval; persisted three-run owner thread eval; failure-analyze",
        "exit_code": 0,
        "summary": "Router accuracy 1.0; persisted same-company model Runs each pass routing/plan/grounding/citation/structured-output/trajectory checks; real schema failure classifies as MODEL_SCHEMA_FAILURE."
      },
      {
        "command": "pip-audit --local --skip-editable; npm audit --audit-level=high",
        "exit_code": 0,
        "summary": "Python audit found no known vulnerabilities; frontend audit found 0 vulnerabilities."
      },
      {
        "command": "frontend typecheck/lint/unit/build; mocked E2E; live-backend E2E",
        "exit_code": 0,
        "summary": "Frontend passed 7 unit tests, 3 mocked E2E and 3 live-backend E2E."
      },
      {
        "command": "python scripts/container_gate.py",
        "exit_code": 0,
        "summary": "Isolated deterministic V1.8.5 Docker gate passed 3/3 reviewed-cache cases and cleaned its separate resources."
      },
      {
        "command": "python scripts/start_demo.py --skip-smoke; runtime/security probes",
        "exit_code": 0,
        "summary": "Owner stack force-recreated at V1.8.5 with auto + model_synthesis; API/Web/n8n localhost-only, docs disabled and Web security headers present."
      },
      {
        "command": "n8n source/unit/lint + actual success/failure smoke",
        "exit_code": 0,
        "summary": "n8n 2.37.9 passed 11 Node tests, 3 actual success cases and 5/5 transport-only bounded failure scenarios."
      },
      {
        "command": "python scripts/mcp_smoke.py --include-discovery --run-id <persisted-owner-run>",
        "exit_code": 0,
        "summary": "Seven-tool MCP live read-only smoke passed company resolution, official filing discovery, facts, evidence, model result and ten-stage Trace."
      }
    ]
  },
  "next_action": {
    "title": "Commit, push and verify V1.8.5 public CI",
    "why": "All fresh local engineering gates pass; remote GitHub state must match before engineering completion can be declared.",
    "first_step": "Run final freshness/diff/secret checks, commit V1.8.5, push main and require all public CI jobs to succeed.",
    "acceptance_evidence": [
      "main and origin/main resolve to the same V1.8.5 commit.",
      "GitHub backend, contracts, eval, security, frontend and containers jobs all succeed.",
      "Owner runtime remains V1.8.5 auto + model_synthesis after local gates.",
      "Only after remote closeout does the remaining release boundary become owner re-acceptance."
    ]
  },
  "blockers": [],
  "pending_decisions": [],
  "resumption": {
    "working_directory": ".",
    "read_first": [
      "README.md",
      "PROJECT_STATUS.md",
      "DECISIONS.md",
      "docs/product/v1.8.5-agent-engineering-hardening.md",
      "docs/architecture/v1.8.5-agent-engineering.md",
      "PORTFOLIO.md"
    ],
    "commands": [
      "uv run researchforge eval",
      "uv run python scripts/validate_contracts.py",
      "uv run python scripts/container_gate.py",
      "uv run python scripts/mcp_smoke.py --api-base http://127.0.0.1:8000 --run-id <RUN_ID>",
      "git diff --check",
      "git status --short"
    ]
  },
  "last_session": {
    "ended_at": "2026-09-06T03:10:00+08:00",
    "summary": "V1.8.5 local engineering gate passed across security/dependency refresh, Product Agent Eval, Failure Analysis, Retrieval Benchmark, MCP, Web/API hardening, Docker and n8n. Remote GitHub closeout remains before owner re-acceptance.",
    "files_changed": [
      "pyproject.toml",
      "uv.lock",
      "src/researchforge/evaluation",
      "src/researchforge/mcp_server.py",
      "scripts/mcp_smoke.py",
      "schemas/v1.8",
      "examples/contracts/v1.8",
      "data/evaluation/v1.8",
      "docs/evidence/v1.8",
      "docs/product/v1.8.5-agent-engineering-hardening.md",
      "docs/architecture/v1.8.5-agent-engineering.md",
      ".github/workflows/ci.yml",
      "README.md",
      "PORTFOLIO.md",
      "DECISIONS.md",
      "CHANGELOG.md"
    ]
  },
  "updated_at": "2026-09-06T03:10:00+08:00"
}
